"conversation_id_str","created_at","favorite_count","full_text","id_str","image_url","in_reply_to_screen_name","lang","location","quote_count","reply_count","retweet_count","tweet_url","user_id_str","username"
"1786001011871543787","Thu May 02 11:53:18 +0000 2024","8","Godzilla minus one https://t.co/TThCAcpc8K","1786001011871543787","https://pbs.twimg.com/media/GMkmdJjWgAAoSvn.jpg","","en","","1","3","1","https://twitter.com/MayoChamploo/status/1786001011871543787","1289748901298413568","MayoChamploo"
"1785861089483255895","Thu May 02 02:37:18 +0000 2024","8","Today actually turned out to be a good day for me. Nice relaxing day at work. Friendship mended with Madi. Godzilla Minus One released in Japan. Getting to watch it all over again. This day is just one big W. Perfect start for my month. But now it's time to say good night. syt https://t.co/mdpyGwWcIq","1785861089483255895","https://pbs.twimg.com/tweet_video_thumb/GMinMUSWAAAshE4.jpg","","en","Kentucky, US of A","0","0","3","https://twitter.com/GDinofang/status/1785861089483255895","1345547236193792005","GDinofang"
"1785999874896609360","Thu May 02 11:48:47 +0000 2024","12","loved godzilla minus one. 10/10 recommended. https://t.co/oL9cafcYlz","1785999874896609360","https://pbs.twimg.com/media/GMklZsXa8AAP044.jpg","","en","your mom","1","1","0","https://twitter.com/adithyeahbitch/status/1785999874896609360","1564405520488091648","adithyeahbitch"
"1786241927878242442","Fri May 03 03:50:37 +0000 2024","0","My Godzilla Tier List up to 2024. I loved Godzilla Minus One and GxK! https://t.co/3GpuhK1Lnp","1786241927878242442","https://pbs.twimg.com/media/GMoBbGtXUAAG3-0.jpg","","en","","0","0","0","https://twitter.com/Amandracula1/status/1786241927878242442","1480429114511216640","Amandracula1"
"1786141798617772517","Thu May 02 21:12:44 +0000 2024","4","Finally watched Godzilla Minus one. It was absolutely breathtaking and perfection! Great character development along with big epic scales of destruction. The cast score effects soundtrack and everything was sensational! By far the best Godzilla movie I've seen yet! 10/10 https://t.co/0Rexf4g5bp","1786141798617772517","https://pbs.twimg.com/media/GMmmgAKWcAAgOTc.jpg","","en","Donegal Ireland","0","2","1","https://twitter.com/DanielCannon92/status/1786141798617772517","2675216486","DanielCannon92"
"1786332781968322766","Fri May 03 09:51:38 +0000 2024","0","Godzilla Minus One sets a new box office record surpassing 80 million becoming Japan's all-time highest-grossing Godzilla movie. Check out our review: https://t.co/2ky9Dyiw7Y https://t.co/i5bS0oxldh","1786332781968322766","https://pbs.twimg.com/media/GMpUMdlaoAAFZ_g.jpg","","en","Kuala Lumpur","0","0","0","https://twitter.com/Kakuchopurei/status/1786332781968322766","872288119185330176","Kakuchopurei"
"1783552274255532165","Thu Apr 25 17:42:53 +0000 2024","151","Godzilla moves just as much in this film as he does in 54 his movements just have more weight to them. Will not let people revisionist history minus one's animation to suddenly be bad it won an Oscar for a reason.","1783552274255532165","","","en","","0","6","15","https://twitter.com/skledimon/status/1783552274255532165","1670200847656005633","skledimon"
"1785747822358196525","Wed May 01 19:07:13 +0000 2024","2","#Top10 most anticipated movie digital releases 1-7 May 2024 1. Godzilla Minus One (2023) 8.3 | May 3 2024 Postwar Japan is at its lowest point when a new crisis emerges in the form of a giant monster baptized in the horrific power of the atomic bomb. https://t.co/pgSgXdvxWT","1785747822358196525","https://pbs.twimg.com/media/GMhALloW8AAx7c1.jpg","","en","UK","2","1","1","https://twitter.com/episodeshl/status/1785747822358196525","1771130867168993280","episodeshl"
"1785685812241195352","Wed May 01 15:00:48 +0000 2024","1","bom dia com t0rrent de godzilla minus one https://t.co/8EXiGqKrWF","1785685812241195352","https://pbs.twimg.com/ext_tw_video_thumb/1740718140059680768/pu/img/-9bA8oBZZ5OpXxiQ.jpg","","en","","0","0","0","https://twitter.com/cstchingfires/status/1785685812241195352","1393640549173895169","cstchingfires"
"1785738563784450451","Wed May 01 18:30:25 +0000 2024","1","finally watching godzilla minus one!!! https://t.co/rpKl5Nuilh","1785738563784450451","https://pbs.twimg.com/media/GMg3u9jXwAAyZL_.png","","en","Undoxxable","1","0","0","https://twitter.com/EpicZud/status/1785738563784450451","1303696497121398787","EpicZud"
"1785095556429455871","Mon Apr 29 23:55:20 +0000 2024","4","Bought $65 of a Japanese Godzilla gotcha for Godzilla Minus One Godzilla https://t.co/KJD6HdBDJ0","1785095556429455871","https://pbs.twimg.com/ext_tw_video_thumb/1781344416013099008/pu/img/5nnRIhA5q1XczHqE.jpg","","en","He/They","0","1","0","https://twitter.com/Saint_coke/status/1785095556429455871","823003484848914433","Saint_coke"
"1783551015213506844","Thu Apr 25 17:37:53 +0000 2024","1997","We are NOT about to do that shin godzilla lol they never move joke with minus one","1783551015213506844","","","en","why tf u wanna know","1","28","96","https://twitter.com/cardbrobot/status/1783551015213506844","1486158908892852230","cardbrobot"
"1785860004513264046","Thu May 02 02:32:59 +0000 2024","4","Plex Update: GODZILLA MINUS ONE IS STREAMING https://t.co/o9rOfgaLkn","1785860004513264046","https://pbs.twimg.com/ext_tw_video_thumb/1785859971411845120/pu/img/8tAXpOFgy5u05Vw6.jpg","","en","","1","1","0","https://twitter.com/BvDpro/status/1785860004513264046","1672313299260547082","BvDpro"
"1785619269390127508","Wed May 01 10:36:23 +0000 2024","10","-- NEW MOVIE --- Name: Godzilla Minus One (2024) Genre: Action Adventure Drama IMDb: 8.3 Story: Post war Japan is at its lowest point when a new crisis emerges in the form of a giant monster baptized in the horrific power of the atomic bomb. WhatsApp: https://t.co/XxmhXdiqBk","1785619269390127508","https://pbs.twimg.com/media/GMfLQPKWsAA7a5x.jpg","","en","Dar/ Mwananyamala Hosp Road","1","2","1","https://twitter.com/latariico/status/1785619269390127508","1288004712927723520","latariico"
"1784729440125153442","Sun Apr 28 23:40:31 +0000 2024","85","Next month Godzilla Minus One will be on streaming in Japan https://t.co/5njfSl9ren","1784729440125153442","https://pbs.twimg.com/media/GMSh9oyWgAANwKr.jpg","","en","","2","2","5","https://twitter.com/kaijugamer2000/status/1784729440125153442","1079914485127827456","kaijugamer2000"
"1785109174474743960","Tue Apr 30 00:49:27 +0000 2024","0","Imagine teasing Minus One Godzilla with a laser pointer. https://t.co/RfpoXsmUOW","1785109174474743960","https://pbs.twimg.com/tweet_video_thumb/GMX7U5taQAAFtvs.jpg","","en","Under Godzilla’s foot!","0","0","0","https://twitter.com/GojiraSpouse/status/1785109174474743960","1132919388","GojiraSpouse"
"1784329136497996014","Sat Apr 27 21:09:52 +0000 2024","12","I actually hate the fact that I can't rewatch Godzilla Minus One STILL https://t.co/AzQn9HtR6y","1784329136497996014","https://pbs.twimg.com/media/GMM14vMXUAAuYQC.jpg","","en","I have 2 years to live ","0","1","0","https://twitter.com/LittGanda4Paro2/status/1784329136497996014","1208800700454576131","LittGanda4Paro2"
"1786186533772701770","Fri May 03 00:10:30 +0000 2024","13","blah blah blah scott cawthon blah blah blah pinkypills idc watch godzilla minus one","1786186533772701770","","","en","he/him | not spoiler free","0","3","3","https://twitter.com/RitoriamAlt/status/1786186533772701770","1650934775232995329","RitoriamAlt"
"1785899261030244830","Thu May 02 05:08:58 +0000 2024","12","The best way to watch godzilla minus one (yes that's the amc gxk popcorn bucket) https://t.co/MxjYrrHRJn","1785899261030244830","https://pbs.twimg.com/media/GMjJ6RHWwAAUVkb.jpg","","en","Iacon, Cybertron","0","0","0","https://twitter.com/MaizePlainsTF/status/1785899261030244830","1124523725653721093","MaizePlainsTF"
"1786069569733530091","Thu May 02 16:25:43 +0000 2024","71","Easily my favorite scene in Godzilla Minus One. It s been a very long time since a movie brought me to tears emotionally but the moment Shikishima started yelling I lost it. What an exceptional performance.","1786069569733530091","","","en","","0","5","6","https://twitter.com/Based_SpaceGoji/status/1786069569733530091","1427716737500278785","Based_SpaceGoji"
"1786312238942580905","Fri May 03 08:30:00 +0000 2024","0","GODZILLA 70th Anniversary Godzilla Minus One Scene Illustration T-Shirt 3(GODZILLA ATTACKS GINZA) May 1st 2024 ～ May 19th 2024 https://t.co/B8tlPOCsBD T-shirt designed for the scene in Godzilla Minus One where Godzilla appears in Ginza. #AIRTWOKYO #Godzilla https://t.co/IRsTKRJQhz","1786312238942580905","https://pbs.twimg.com/media/GMkDIgdboAA9yBG.jpg","","en","TOKYO","0","0","0","https://twitter.com/AirTwokyo/status/1786312238942580905","1435522234974498818","AirTwokyo"
"1785814474747736422","Wed May 01 23:32:04 +0000 2024","1","Godzilla minus one is out on yts https://t.co/Jx0FpUSif8","1785814474747736422","https://pbs.twimg.com/media/GMh8zORXoAA6Qds.jpg","","en","🇸🇳","0","1","0","https://twitter.com/CharlesNdiaye96/status/1785814474747736422","1080243790932258816","CharlesNdiaye96"
"1785907291608490266","Thu May 02 05:40:53 +0000 2024","131","A lot of you guys are being very bold right now sharing Godzilla Minus One clips https://t.co/lzTioHJnzb","1785907291608490266","https://pbs.twimg.com/media/GMjRN2vasAASGzt.jpg","","en","Mentmore Towers","0","1","5","https://twitter.com/KSPraidsagain/status/1785907291608490266","1364406071901609986","KSPraidsagain"
"1785701406155960506","Wed May 01 16:02:46 +0000 2024","119","Godzilla Minus One (2023)","1785701406155960506","","","en","","1","1","10","https://twitter.com/monsterbox/status/1785701406155960506","14263542","monsterbox"
"1786108141979173214","Thu May 02 18:58:59 +0000 2024","3","Okay now that Godzilla Minus One is out on physical we aren't going to do a 180 on this movie and say it's shit and do revisionism right? Let's be a good fandom for once. Let's not fuck this up. https://t.co/8HIkf9jPT3","1786108141979173214","https://pbs.twimg.com/media/GMmH491bEAAG9JJ.jpg","","en","","0","2","0","https://twitter.com/VitisSweets/status/1786108141979173214","910540122755538944","VitisSweets"
"1785685871259197778","Wed May 01 15:01:02 +0000 2024","1","Godzilla Minus One 1080p Bluray Latino Audio todavia de Cine y video fullhd https://t.co/DhSpmJPhIR https://t.co/BF57ywkCHs","1785685871259197778","https://pbs.twimg.com/media/GMgHuZSWUAAoRv9.jpg","","en","","1","1","0","https://twitter.com/iCynthialover/status/1785685871259197778","1594536470584360961","iCynthialover"
"1785888452841783477","Thu May 02 04:26:02 +0000 2024","0","Finally seated for Godzilla Minus One https://t.co/nOOTj5gavJ","1785888452841783477","https://pbs.twimg.com/ext_tw_video_thumb/1735894695795097601/pu/img/kesBHlEugqhCZE70.jpg","","en","He/Him","0","0","0","https://twitter.com/Syakirin245/status/1785888452841783477","4835657360","Syakirin245"
"1785773760466804937","Wed May 01 20:50:17 +0000 2024","91","Can I just speak on the utter irony of OP not caring about a war /genocide because they want to watch Godzilla Minus One the one Godzilla movie besides GMK that addresses war and its traumatic affects most directly?","1785773760466804937","","","en","why tf u wanna know","1","4","14","https://twitter.com/cardbrobot/status/1785773760466804937","1486158908892852230","cardbrobot"
"1786118552342118847","Thu May 02 19:40:22 +0000 2024","22","To Be fair Minus One Godzilla was Having a bad day https://t.co/f9ZpO1aieA","1786118552342118847","https://pbs.twimg.com/media/GMmRR6zWwAAdOJk.jpg","","en","","0","2","2","https://twitter.com/kaijugamer2000/status/1786118552342118847","1079914485127827456","kaijugamer2000"
"1784980423853940942","Mon Apr 29 16:17:51 +0000 2024","37","GODZILLA MINUS ONE STREAMING RELEASE WEEK https://t.co/cb7KcoNYKP","1784980423853940942","https://pbs.twimg.com/ext_tw_video_thumb/1737470802885251073/pu/img/U6xzMRt_Fs_nvNtf.jpg","","en","Houston","0","2","7","https://twitter.com/LocalSoundwave/status/1784980423853940942","1581907795","LocalSoundwave"
"1786255606502010886","Fri May 03 04:44:58 +0000 2024","2","not being able to see this for so long was like actual torture https://t.co/gkAHQtstL6","1786255606502010886","","","en","🇺🇸 🇪🇹","0","0","0","https://twitter.com/its_reo1/status/1786255606502010886","1551190703639654400","its_reo1"
"1786061280652272058","Thu May 02 15:52:47 +0000 2024","7","Finished watching Godzilla Minus One I finally get it now. It's peak. https://t.co/FYKjXzZqpS","1786061280652272058","https://pbs.twimg.com/media/GMldRL8boAEDjmg.jpg","","en","V-tuber Rabbit Hole","0","1","0","https://twitter.com/KomiCh_/status/1786061280652272058","1142798477044244481","KomiCh_"
"1785555127975149655","Wed May 01 06:21:31 +0000 2024","6","We are downloading and rewatching Godzilla Minus One tonight (hopefully) https://t.co/CE8QYRO9aP","1785555127975149655","https://pbs.twimg.com/media/GMeQ7QGXUAAovaB.jpg","","en","Swag City Coolsberg/💜Juri💜","1","2","0","https://twitter.com/Yolo360Swag/status/1785555127975149655","1496842288785498122","Yolo360Swag"
"1786265381876982184","Fri May 03 05:23:48 +0000 2024","0","Wow Godzilla minus one super movie waiting for next part https://t.co/oebT28o6b9","1786265381876982184","https://pbs.twimg.com/media/GMoW5AXa4AATbNf.jpg","","en","India","0","0","0","https://twitter.com/KDHANUSH007/status/1786265381876982184","850729924424081413","KDHANUSH007"
"1785012522254475413","Mon Apr 29 18:25:23 +0000 2024","1076","A new @CAVITYCOLORS GODZILLA MINUS ONE officially licensed apparel collection will be available starting today at 5 PM EST. https://t.co/uoWb9fnnSR","1785012522254475413","https://pbs.twimg.com/media/GMWja-OWgAA3xTi.jpg","","en","","11","5","176","https://twitter.com/KaijuNewsOutlet/status/1785012522254475413","1020742989558239232","KaijuNewsOutlet"
"1785898966413894130","Thu May 02 05:07:48 +0000 2024","10","#Godzilla Minus One is releasing on digital oficially TOMORROW! So I can finally watch it in good quality... LA OPERA ES MAÑANA ️ https://t.co/0JrU7sQAoC","1785898966413894130","https://pbs.twimg.com/ext_tw_video_thumb/1785898100365602816/pu/img/-10lHKW3_leaSUmj.jpg","","en","Ecuador","0","0","3","https://twitter.com/Allo_Dekaexis/status/1785898966413894130","1312434546391027712","Allo_Dekaexis"
"1786165810769055902","Thu May 02 22:48:09 +0000 2024","83","Weirdly enough between OPPENHEIMER and GODZILLA MINUS ONE and Fallout there s a bit of a market for nuclear war-related projects right now even DUNE: PART TWO got a nuke sequence lol. If Villeneuve really wants to make this better strike while the uranium is hot I say.","1786165810769055902","","","en","","0","8","9","https://twitter.com/JohnnySobczak/status/1786165810769055902","3017937264","JohnnySobczak"
"1786074813502742921","Thu May 02 17:02:24 +0000 2024","1","@RobbieEirelufc I used https://t.co/GlBSCjuesb","1786078801618952317","","RobbieEirelufc","en","","0","1","0","https://twitter.com/valid_soul/status/1786078801618952317","1735653886453776384","valid_soul"
"1785888987304882571","Thu May 02 04:28:09 +0000 2024","6","the japs protected godzilla minus one from being bootlegged more than they protect the true affects of what the atom bomb has done to their lineage","1785888987304882571","","","en","antieverything ","1","2","2","https://twitter.com/KBthaburner_/status/1785888987304882571","1396640913309454337","KBthaburner_"
"1785507590379589745","Wed May 01 03:12:37 +0000 2024","15","Anyways here's the entire 4K Blu-ray for Godzilla: Minus One https://t.co/1DwASIY9FN","1785507590379589745","","","en","","2","2","1","https://twitter.com/manuelll_05/status/1785507590379589745","766831764345987072","manuelll_05"
"1785355712698388689","Tue Apr 30 17:09:06 +0000 2024","0","Godzilla Minus One Ginza Arrival T-shirt https://t.co/FiUizhgDCu https://t.co/em4Lwu2jmS","1785355712698388689","https://pbs.twimg.com/media/GMbbjWKboAAbxze.jpg","","en","USA","0","0","0","https://twitter.com/Legendusashirtt/status/1785355712698388689","1575016329064521730","Legendusashirtt"
"1786114516884787234","Thu May 02 19:24:19 +0000 2024","220","APB: Godzilla Minus One is happening. Stay tuned","1786114516884787234","","","en","","1","18","7","https://twitter.com/LUPASAN2/status/1786114516884787234","1314545520422072320","LUPASAN2"
"1786339197340811425","Fri May 03 10:17:07 +0000 2024","0","Godzilla Minus One .","1786339197340811425","","","en","","0","0","0","https://twitter.com/speederrrr/status/1786339197340811425","4890196413","speederrrr"
"1786037165308420132","Thu May 02 14:16:57 +0000 2024","25","Finished Watching Godzilla Minus One Incredible movie with stunning visuals !! Superbly directed and well written. The soundtrack was surprisingly amazing too. The budget being around $15 million is beyond me cuz the VFX &amp; CGI was top notch throughout minus a few nitpicks. https://t.co/CVTvugjZqb","1786037165308420132","https://pbs.twimg.com/media/GMlHTtIb0AAT9as.jpg","","en","Watch my edits","0","5","1","https://twitter.com/NemesisDasta/status/1786037165308420132","1277255200907177986","NemesisDasta"
"1786009064075395129","Thu May 02 12:25:17 +0000 2024","99","godzilla minus one if gojitwt was in it","1786009064075395129","","","en","why tf u wanna know","0","1","10","https://twitter.com/cardbrobot/status/1786009064075395129","1486158908892852230","cardbrobot"
"1786327613926953170","Fri May 03 09:31:06 +0000 2024","6","It's a real shame that Godzilla Minus One has only been added to Amazon Prime in Japan. And all the other Godzilla films too. Because people will just pirate it now. And the other films have never been available to watch outside of Japan and the USA.","1786327613926953170","","","en","Newcastle Upon Tyne, England","0","2","0","https://twitter.com/Danburden1138/status/1786327613926953170","60855911","Danburden1138"
"1785576229267222686","Wed May 01 07:45:22 +0000 2024","263","Godzilla Minus one Loading Anyone Waiting For Movie ","1785576229267222686","","","en","","1","37","17","https://twitter.com/TGM4UU/status/1785576229267222686","1751214883205730304","TGM4UU"
"1786277274628616545","Fri May 03 06:11:04 +0000 2024","4","Japan B.O. Godzilla Minus One cleared ¥7.5B ($51.1M) for the 4 day holiday wknd and climbed to 4.986M in attendance. GxK opened to ¥622M ($4M) over 4 days w/ 417 000 in attendance. Charts: https://t.co/FD5bip8T6E","1786277274628616545","https://pbs.twimg.com/media/GMohk66WMAAvTIS.jpg","","en","Behind you","1","0","2","https://twitter.com/GMANofMysteroid/status/1786277274628616545","2484607032","GMANofMysteroid"
"1785854820739399847","Thu May 02 02:12:23 +0000 2024","1","Brabo. My ½ review of Godzilla Minus One on Letterboxd https://t.co/L2u2VRKBjW","1785854820739399847","","","en","Brazil","0","0","0","https://twitter.com/_altgui/status/1785854820739399847","1299188269670903808","_altgui"
"1786236346681463285","Fri May 03 03:28:26 +0000 2024","3","godzilla minus one dont be shit pls","1786236346681463285","","","en","in your walls ","1","3","0","https://twitter.com/Bigpuppymaster1/status/1786236346681463285","1521640107366825986","Bigpuppymaster1"
"1783301527534178313","Thu Apr 25 01:06:30 +0000 2024","110","Godzilla but replace experiencing the horrors with being the horrors","1783301527534178313","","","en","mothra’s daughter","0","1","9","https://twitter.com/AutistiKal/status/1783301527534178313","1683454739940356101","AutistiKal"
"1785766974921785524","Wed May 01 20:23:19 +0000 2024","81","People meatriding Toho and tattletailing on people pirating Godzilla Minus One is the most baby-brained suck-up shit ever dude it is literally not available anywhere else in the world and won t be for the foreseeable future because of a weird game of chicken between them and WB.","1785766974921785524","","","en","he/him • 25 • autistic","0","4","18","https://twitter.com/_TheSmartAlec1/status/1785766974921785524","1427833226177957890","_TheSmartAlec1"
"1786193855303348727","Fri May 03 00:39:35 +0000 2024","12","Bout to feed the horses Can someone PLEASE Send me a link to Godzilla Minus ONE I'm begging you","1786193855303348727","","","en","","0","2","1","https://twitter.com/NewSalvage/status/1786193855303348727","3099290820","NewSalvage"
"1785700521480724848","Wed May 01 15:59:15 +0000 2024","5","can anyone lob a godzilla minus one hd link with english subs... im a girl btw...","1785700521480724848","","","en","She/They/It 18","1","3","1","https://twitter.com/NewGenesis21/status/1785700521480724848","1704120067611340800","NewGenesis21"
"1786337359383982381","Fri May 03 10:09:49 +0000 2024","0","Godzilla Minus One:","1786337359383982381","","","en","","0","0","0","https://twitter.com/drowsyluma/status/1786337359383982381","1657130112","drowsyluma"
"1785773760282308988","Wed May 01 20:50:17 +0000 2024","165","DONT POST MINUS ONE FOOTAGE HERE TOHO WILL TAKE LEGAL ACTION ON YOUR ACCOUNT","1785773760282308988","","","en","","2","6","17","https://twitter.com/color_godzilla/status/1785773760282308988","1705109739657711616","color_godzilla"
"1785559612026163324","Wed May 01 06:39:20 +0000 2024","3","How the FUCK did we get a heatwave instead of Godzilla Minus One in theatres","1785559612026163324","","","en","Singapore","1","0","2","https://twitter.com/Venkyra21/status/1785559612026163324","1534158355337318400","Venkyra21"
"1786199313745432708","Fri May 03 01:01:17 +0000 2024","6","Que filme do karalh0 de bom!!!!!!!!!! My review of Godzilla Minus One on Letterboxd https://t.co/3VjCK26Qcc","1786199313745432708","","","en","Sao Paulo, Brazil","0","1","0","https://twitter.com/A24fav/status/1786199313745432708","1583064873210101761","A24fav"
"1785830334707241100","Thu May 02 00:35:05 +0000 2024","4","FINISHED GODZILLA MINUS ONE HOLY FUCK THAT MOVIE IS SO GOOD","1785830334707241100","","","en","Hell","0","2","0","https://twitter.com/Maskydude207/status/1785830334707241100","1280584786231332866","Maskydude207"
"1785237195776790547","Tue Apr 30 09:21:37 +0000 2024","1","@Awilddingo1 Still in stock if you don't mind paying shipping https://t.co/PFgv9af5Be","1785238065771839895","","Awilddingo1","en","","0","1","0","https://twitter.com/TheGodzillaDude/status/1785238065771839895","1417224416","TheGodzillaDude"
"1786337172351856946","Fri May 03 10:09:05 +0000 2024","0","Which version did you watch the Godzilla Minus One?","1786337172351856946","","","en","Kathmandu Nepal","0","0","0","https://twitter.com/eigfisev/status/1786337172351856946","775907857107648512","eigfisev"
"1786307865969656173","Fri May 03 08:12:37 +0000 2024","0","There's tremendous beauty in this film. Hollywood please take note this is how Godzilla movie should be made. Just death destruction and an emotional core. Godzilla Minus One on Letterboxd https://t.co/BenYFj3VbH","1786307865969656173","","","en","","0","0","0","https://twitter.com/GeorgeBailey42/status/1786307865969656173","823499209","GeorgeBailey42"
"1786226379383513334","Fri May 03 02:48:49 +0000 2024","2","O FINAL ME DEIXOU EM PRANTOS My review of Godzilla Minus One on Letterboxd https://t.co/RLsc3110KY","1786226379383513334","","","en","noah kahan discography.","0","0","0","https://twitter.com/titansfilm/status/1786226379383513334","1359963996607111170","titansfilm"
"1785689900286705885","Wed May 01 15:17:03 +0000 2024","1","OBRA PRIMA My review of Godzilla Minus One (2023) on @letterboxd: https://t.co/KD4pPV8vSa","1785689900286705885","","","en","Recife, Brasil","0","0","0","https://twitter.com/walbinh0/status/1785689900286705885","3106036318","walbinh0"
"1785614782856310985","Wed May 01 10:18:34 +0000 2024","2","Anyone got the Godzilla Minus One subtitled movie?","1785614782856310985","","","en","im/him","0","2","0","https://twitter.com/oneofmyturns169/status/1785614782856310985","1696746599706173440","oneofmyturns169"
"1786056285818900624","Thu May 02 15:32:56 +0000 2024","22","This applies to Godzilla and Kaiju too","1786056285818900624","","","en","mothra’s daughter","0","1","2","https://twitter.com/AutistiKal/status/1786056285818900624","1683454739940356101","AutistiKal"
"1786218514661126263","Fri May 03 02:17:34 +0000 2024","18","All these Godzilla minus one content there is no hope for Southeast Asia . ","1786218514661126263","","","en","out of no where","0","3","0","https://twitter.com/kurosaki_sasori/status/1786218514661126263","1082840096385036288","kurosaki_sasori"
"1786219950723719246","Fri May 03 02:23:17 +0000 2024","42","i am so fucking happy i can finally pirate Godzilla Minus One in 4K fuck you Toho for only screening it in Japan! the rest of Asia exists too!","1786219950723719246","","","en","he/him","0","2","3","https://twitter.com/weeabob/status/1786219950723719246","29971417","weeabob"
"1785875441611337919","Thu May 02 03:34:19 +0000 2024","4","godzilla minus one has entered #them sites","1785875441611337919","","","en","antieverything ","0","2","0","https://twitter.com/KBthaburner_/status/1785875441611337919","1396640913309454337","KBthaburner_"
"1785854307008643561","Thu May 02 02:10:21 +0000 2024","0","SOMEONE PLEASE I WANNA WATCH GODZILLA MINUS ONE REEEEEEEEEEE","1785854307008643561","","","en","","0","2","0","https://twitter.com/RaiRaikiri/status/1785854307008643561","873631778644164608","RaiRaikiri"
"1786017159321206842","Thu May 02 12:57:28 +0000 2024","7","Godzilla minus one was pretty good","1786017159321206842","","","en","","0","2","0","https://twitter.com/RedOfX7/status/1786017159321206842","1675291671968243715","RedOfX7"
"1786225051064521098","Fri May 03 02:43:33 +0000 2024","2","GODZILLA MINUS ONE IS FUCKING AMAZING I FUCKING CRIED 10/10","1786225051064521098","","","en","","0","2","0","https://twitter.com/lessen_tertle/status/1786225051064521098","3238898126","lessen_tertle"
