"conversation_id_str","created_at","favorite_count","full_text","id_str","image_url","in_reply_to_screen_name","lang","location","quote_count","reply_count","retweet_count","tweet_url","user_id_str","username"
"1785889725745668332","Thu May 02 04:31:05 +0000 2024","620","Godzilla Minus One director has sparked Space Godzilla and Biollante fan theories after confirming a key piece of lore that seemingly points to the direction for the sequel. https://t.co/fTLu0SpdaE https://t.co/58NSYFZVFz","1785889725745668332","https://pbs.twimg.com/media/GMjBOXlXsAAGChs.jpg","","en","","6","10","95","https://twitter.com/IGN/status/1785889725745668332","18927441","IGN"
"1786264605225795716","Fri May 03 05:20:43 +0000 2024","0","Godzilla Minus One went hard. Fkyh. https://t.co/TGrP6D5Zxv","1786264605225795716","https://pbs.twimg.com/tweet_video_thumb/GMoWL90W8AAhk5N.jpg","","en","SA210","0","0","0","https://twitter.com/Asteroid__M/status/1786264605225795716","1344313907192745984","Asteroid__M"
"1786034109367697538","Thu May 02 14:04:49 +0000 2024","3","I finally watched Godzilla Minus One https://t.co/zv0QV796TN","1786034109367697538","https://pbs.twimg.com/tweet_video_thumb/GMlEjWaWwAA3A-P.jpg","","en","365x 20 | Croatia 🇭🇷","0","1","0","https://twitter.com/matejborsic/status/1786034109367697538","1313946475316097030","matejborsic"
"1786067198680985781","Thu May 02 16:16:18 +0000 2024","12","Honestly I still think Shin Godzilla is my favorite modern entry of the series. The Higuchi/Anno/Sagisu combo is just filled with so much sauce. Sure it's not as emotionally driven as Minus One but it felt the most grounded to me and I love how unique it is. https://t.co/RMkKAxqRo5","1786067198680985781","https://pbs.twimg.com/media/GMlhXtibUAEKlfM.jpg","","en","Earth","0","2","1","https://twitter.com/mattrgl_/status/1786067198680985781","3289372819","mattrgl_"
"1786211558194061627","Fri May 03 01:49:56 +0000 2024","24","Wait if Godzilla Minus One takes place directly after the war does that mean a hypothetical sequel would take place in 1954? https://t.co/mTAqO3rLxS","1786211558194061627","https://pbs.twimg.com/tweet_video_thumb/GMnl7iJaEAAV-4E.jpg","","en","","1","1","3","https://twitter.com/johann122004/status/1786211558194061627","1281931494097813505","johann122004"
"1786283698146754931","Fri May 03 06:36:35 +0000 2024","11","Me 1 hour 30 mins into Minus One when I realized there's no government conference room freakout scene where unnamed military general #20 suggests dropping the 480th bomb on Godzilla after the previous 479 did not work https://t.co/w6tID5IMV0","1786283698146754931","https://pbs.twimg.com/tweet_video_thumb/GMoniwgaMAAPkXq.jpg","","en","@YorKisser ♡","0","1","1","https://twitter.com/ern_ygr/status/1786283698146754931","1150324109122740224","ern_ygr"
"1785786779569713505","Wed May 01 21:42:01 +0000 2024","27","Just found Godzilla Minus One with subtitles https://t.co/loROu6C1IZ","1785786779569713505","https://pbs.twimg.com/tweet_video_thumb/GMhjm_lWsAAeex8.jpg","","en","16 ","0","4","0","https://twitter.com/Dubzzpain/status/1785786779569713505","1250815996165832706","Dubzzpain"
"1785707975975313714","Wed May 01 16:28:52 +0000 2024","17","it s finally time to watch godzilla minus one hd https://t.co/dKpQmDrE13","1785707975975313714","https://pbs.twimg.com/tweet_video_thumb/GMgb737XUAA0Vvd.jpg","","en","he/she | 16 ","0","3","0","https://twitter.com/topsecretokyo/status/1785707975975313714","1740839612916838400","topsecretokyo"
"1786152216950129007","Thu May 02 21:54:08 +0000 2024","2","This Godzilla after being bombed: oh damn it's okay humans I forgive you Minus One Godzilla after being bombed: https://t.co/fnHte8gEHj","1786152216950129007","https://pbs.twimg.com/tweet_video_thumb/GMmv-EhW4AADmvm.jpg","","en","My house lmao ","0","0","0","https://twitter.com/SpagDev/status/1786152216950129007","1503398853692829698","SpagDev"
"1785702705035382811","Wed May 01 21:13:19 +0000 2024","13","@everymovieplug Godzilla minus one official trailer https://t.co/pn5Rm8ig3L","1785779557104070941","https://pbs.twimg.com/ext_tw_video_thumb/1785779041791848448/pu/img/wHIvAk17YZvwyFkk.jpg","everymovieplug","en","Nigeria","0","1","4","https://twitter.com/THEvictoratangs/status/1785779557104070941","1338065411741540352","THEvictoratangs"
"1786314579393577089","Fri May 03 08:39:18 +0000 2024","4","Godzilla Minus One (2023) https://t.co/caEnDf75Rx","1786314579393577089","https://pbs.twimg.com/media/GMpDlgHbgAAkLtt.jpg","","en","26 they","0","0","0","https://twitter.com/boysheron/status/1786314579393577089","1482846300953780225","boysheron"
"1785779410102006167","Wed May 01 21:12:44 +0000 2024","9","to everyone using that one pirating website for Godzilla minus one; click on the closed captions option and select English to open up this menu then select this last one for better subtitles (it's nearly perfect) https://t.co/Ug3lCzn4oi","1785779410102006167","https://pbs.twimg.com/media/GMhc6OkXsAAUB04.jpg","","en","Halcandra","0","3","1","https://twitter.com/Eggggguy/status/1785779410102006167","1235705159243755520","Eggggguy"
"1785709964272554250","Wed May 01 16:36:47 +0000 2024","3162"," Godzilla Minus One is now available on Blu-ray and DVD in Japan. https://t.co/GS7qxZnMYH","1785709964272554250","https://pbs.twimg.com/media/GMgdvy6WcAI0Rdv.jpg","","en","","159","72","276","https://twitter.com/KaijuNewsOutlet/status/1785709964272554250","1020742989558239232","KaijuNewsOutlet"
"1785772449537146909","Wed May 01 20:45:04 +0000 2024","75","Godzilla Minus One Movie budget was $15 million and they produced peak cinema. https://t.co/kDrGPu3ND6","1785772449537146909","","","en","Knightmare timeline ","0","6","13","https://twitter.com/AkkiZac019/status/1785772449537146909","1297914011414138886","AkkiZac019"
"1786292598153359376","Fri May 03 07:11:57 +0000 2024","2","Weekends are for movies. @_Thrixian have you seen Godzilla minus One? (The name is funny ) download here https://t.co/mnh4qH41um https://t.co/auU0B0fUju","1786292598153359376","https://pbs.twimg.com/media/GMovpriXQAAi3ZW.jpg","","en","Earth.","1","1","2","https://twitter.com/steewritesblog/status/1786292598153359376","1623611810","steewritesblog"
"1786115477787324796","Thu May 02 19:28:08 +0000 2024","30","The humans in Minus One are so well written that I didn t mind Godzilla not having that much screentime in the film. Their relationships their characteristics their developments everything about them was perfect. https://t.co/kNUayUUqi1","1786115477787324796","https://pbs.twimg.com/media/GMmOjX9X0AABMUD.jpg","","en","Earth | 23 | he/him |","0","3","8","https://twitter.com/Fabio_JRogue/status/1786115477787324796","1168292057988947968","Fabio_JRogue"
"1786137571904668110","Thu May 02 20:55:56 +0000 2024","28","Now that I watched Goji Minus One I just had to make a ranking to where I'd put it alongside the Shin Toku trilogy fr #Ultraman #KamenRider #Godzilla #Tokusatsu https://t.co/L53EsQBrAm","1786137571904668110","https://pbs.twimg.com/media/GMmip-CbQAIfwdF.jpg","","en","#1 Tiga & Agito fan,He/him(21)","0","5","4","https://twitter.com/Carnotaurus4774/status/1786137571904668110","1319259742812815361","Carnotaurus4774"
"1786300920239685732","Fri May 03 07:45:01 +0000 2024","0","FINALLY WATCHED THIS FUCKING MOVIE GODZILLA MINUS ONE IS A MASTERPIECE RAAAAGHGHHHH https://t.co/Niegh1HVva","1786300920239685732","https://pbs.twimg.com/tweet_video_thumb/GMo3N4qXUAEGSDb.jpg","","en","🇰🇼/🇸🇦","0","0","0","https://twitter.com/hamoodisanalien/status/1786300920239685732","1230517070447697922","hamoodisanalien"
"1786206450819231816","Fri May 03 01:29:38 +0000 2024","70","my reaction to Godzilla Nuking Ginza in Minus one https://t.co/TDnTOazid0","1786206450819231816","https://pbs.twimg.com/tweet_video_thumb/GMnhS_EW0AAvq8b.jpg","","en","","0","3","5","https://twitter.com/kaijugamer2000/status/1786206450819231816","1079914485127827456","kaijugamer2000"
"1785968169024172114","Thu May 02 09:42:47 +0000 2024","11","Morning everyone Woke up early today cause I have a class to go to But I checked something and GODZILLA MINUS ONE ON MY WEBSITE IS ON HD LETS GOOOOOOOOO https://t.co/sdw8sm6xX6","1785968169024172114","https://pbs.twimg.com/tweet_video_thumb/GMkIlH0W8AAmuOM.jpg","","en","","0","2","1","https://twitter.com/kyanzilla/status/1785968169024172114","1576755419921391617","kyanzilla"
"1786060464490766437","Thu May 02 15:49:32 +0000 2024","10","I'm out of things to post today so here's a test animation of Otachi that I made a while ago. I'm thinking about using it for a test fight against Minus One something like Ghidorah carrying Godzilla up to the sky maybe. #PacificRim https://t.co/iHvOKjUwZm","1786060464490766437","https://pbs.twimg.com/ext_tw_video_thumb/1786059771432357888/pu/img/UsUiPe7sgdd6AqS7.jpg","","en","","0","0","1","https://twitter.com/KingMuto2/status/1786060464490766437","1283057458999631872","KingMuto2"
"1783210304190435443","Wed Apr 24 19:04:01 +0000 2024","814"," Drop it! GODZILLA MINUS ONE (an Oscar winning film! ) arrives next Monday April 29 at 5 PM EST! Here s another SNEAK PEEK of one of the officially licensed shirts &amp; hoodies! Who s ready for our monstrous new apparel collection? Let us know! #GodzillaMinusOne https://t.co/CFQ3nUBklf","1783210304190435443","https://pbs.twimg.com/media/GL86SNpWkAAX2_7.jpg","","en","Atlanta, GA","13","18","110","https://twitter.com/CAVITYCOLORS/status/1783210304190435443","16064458","CAVITYCOLORS"
"1786162214900035764","Thu May 02 22:33:51 +0000 2024","5","Just watched the greatest movie ever Godzilla minus one Godzilla is so menacing i love her https://t.co/h1zvGFzGXe","1786162214900035764","https://pbs.twimg.com/tweet_video_thumb/GMm5EDCXoAA8dLv.jpg","","en","He/him . 25","0","0","0","https://twitter.com/Tayact3/status/1786162214900035764","1524784351560482816","Tayact3"
"1786110370559758612","Thu May 02 19:07:51 +0000 2024","2","Watching Godzilla Minus One at 1am was a mistake it is now 3am... How the fuck am I supposed to sleep after watching that. https://t.co/4x2sKc0QjK","1786110370559758612","https://pbs.twimg.com/tweet_video_thumb/GMmJ6SaaYAEEe0f.jpg","","en","","0","0","1","https://twitter.com/HatsuOwari/status/1786110370559758612","1287706551457726464","HatsuOwari"
"1785754054171185192","Wed May 01 19:31:58 +0000 2024","665","Godzilla Minus One releases on home media today in Japan. Only a matter of time before we start getting it in other regions! Here s my tribute piece again to commemorate the occasion. Really hope @nostoro can see this at some point! https://t.co/gLBlAdex0K","1785754054171185192","https://pbs.twimg.com/media/GMhF2IvXsAAFrQS.jpg","","en","Monsterland Control Room","0","0","140","https://twitter.com/seaguns_art/status/1785754054171185192","985865506082246661","seaguns_art"
"1786182231225938161","Thu May 02 23:53:24 +0000 2024","5","Godzilla minus one tomorrow https://t.co/fYcSpC5ILs","1786182231225938161","https://pbs.twimg.com/tweet_video_thumb/GMnLRLPWgAAoQne.jpg","","en","Tartarus ","0","0","0","https://twitter.com/NachC1106/status/1786182231225938161","1699301322896347136","NachC1106"
"1786277377678733807","Fri May 03 06:11:28 +0000 2024","3","finally watched Godzilla Minus One through unconventional methods and GOD AM I GETTING MORE EMOTIONAL OR SMTH CUZ I CRIED LIKE 10 TIMES WATCHING; THAT FINAL CONFRONTATION AT THE END HAD MY HEART POUNDING SO FUCKING HARD THE ENTIRE TIME IT WAS INSANE I WISH I SAW IT IN THEATERS https://t.co/pxfkKFPSUM","1786277377678733807","https://pbs.twimg.com/media/GMohzVBaUAAS3e8.jpg","","en","any pronouns | 🇵🇭","0","0","0","https://twitter.com/tokikea_/status/1786277377678733807","1710515598516776960","tokikea_"
"1783563650030023111","Thu Apr 25 18:28:05 +0000 2024","8663","I really love how in Minus One pre-mutated Godzilla moves in a really fluid and animalistic way much like what you'd expect from Jurassic Park. Then the bomb drops and he starts moving all robotic and stiff as if his mind hasn't caught up with the way his body has changed.","1783563650030023111","","","en","My home","9","30","474","https://twitter.com/Goji_Saurus/status/1783563650030023111","1051476619569827841","Goji_Saurus"
"1786143711140987129","Thu May 02 21:20:20 +0000 2024","1","Godzilla Minus One (2023) https://t.co/PD4KsL2lWp","1786143711140987129","https://pbs.twimg.com/ext_tw_video_thumb/1786143573030944769/pu/img/3sv-7jDvP5-GcgK9.jpg","","en","","0","0","0","https://twitter.com/Adi_YoonA46/status/1786143711140987129","1364703588530884611","Adi_YoonA46"
"1785436882160996620","Tue Apr 30 22:31:39 +0000 2024","1357","Here's a few making-of pics from the creation of my GODZILLA MINUS ONE shirt for @CAVITYCOLORS! https://t.co/7nnUnzBkjt","1785436882160996620","https://pbs.twimg.com/media/GMckmaJWoAEb3MX.png","","en","Austin","2","9","193","https://twitter.com/spankzilla85/status/1785436882160996620","272048890","spankzilla85"
"1786334565025615926","Fri May 03 09:58:43 +0000 2024","0","I just finished Godzilla Minus One and I can't believe I got emotional over the human drama in a godzilla film. Wonderful https://t.co/tyBzPNvfUM","1786334565025615926","https://pbs.twimg.com/media/GMpVKk0bYAAxr4k.jpg","","en","","0","0","0","https://twitter.com/gerald_kwee/status/1786334565025615926","1409375055591612417","gerald_kwee"
"1786037081938301217","Thu May 02 14:16:37 +0000 2024","21","Best Shot From Godzilla Minus One https://t.co/rB9MaF8Bw4","1786037081938301217","https://pbs.twimg.com/ext_tw_video_thumb/1785718737623998464/pu/img/A3BzvnHdJgsUjere.jpg","","en","","0","0","3","https://twitter.com/fire_rick88/status/1786037081938301217","1274937434325704705","fire_rick88"
"1785908587308429705","Thu May 02 05:46:02 +0000 2024","1","Godzilla Minus One clips on the timeline nature is healing https://t.co/C0yTVMjJb6","1785908587308429705","https://pbs.twimg.com/tweet_video_thumb/GMjSZH_W0AAJmmh.jpg","","en","804/NoVa","0","0","0","https://twitter.com/tlbower501/status/1785908587308429705","1019280282984296448","tlbower501"
"1786174050449891633","Thu May 02 23:20:53 +0000 2024","1","I CAN FINALLY WATCH GODZILLA MINUS ONE AFTER WAITING FOR 6 MONTHS https://t.co/2DIQ8UCdnO","1786174050449891633","https://pbs.twimg.com/tweet_video_thumb/GMnD07qXcAAG-_k.jpg","","en","","0","1","0","https://twitter.com/Youssefzaky10/status/1786174050449891633","1052306229232619521","Youssefzaky10"
"1786075914658300285","Thu May 02 16:50:56 +0000 2024","15","I ve finally found a good copy of Godzilla minus one https://t.co/utGlXFQBDb","1786075914658300285","https://pbs.twimg.com/ext_tw_video_thumb/1621035398175641601/pu/img/jKj-UUrc8yYTW_Fc.jpg","","en","","1","2","0","https://twitter.com/_Riddock_/status/1786075914658300285","1674748365127528449","_Riddock_"
"1786307068921786611","Fri May 03 08:09:27 +0000 2024","1","godzilla minus one is finally here.... https://t.co/UrXmp98SfU","1786307068921786611","https://pbs.twimg.com/media/GMo8zhSbsAAtwrZ.jpg","","en","down the rabbit hole","0","0","0","https://twitter.com/shieon8/status/1786307068921786611","1441949651641401348","shieon8"
"1785890553412120746","Thu May 02 14:28:46 +0000 2024","3","I get back from watching Godzilla Minus One and this popped off for some reason. Anyway watch Godzilla Minus One and also do your daily click thanks. https://t.co/1wATbeZlNT","1786040136113029590","","Wolchron","en","","0","0","3","https://twitter.com/Wolchron/status/1786040136113029590","87321651","Wolchron"
"1784973302227738932","Mon Apr 29 15:49:33 +0000 2024","60","Godzilla Minus One https://t.co/6LRasSmNIx","1784973302227738932","https://pbs.twimg.com/media/GMV_wacX0AAWiFf.jpg","","en","308 Negra Aroya Ln.","0","2","12","https://twitter.com/kujira_mk/status/1784973302227738932","1003294005730467840","kujira_mk"
"1785838809575288879","Thu May 02 01:08:46 +0000 2024","62","godzilla minus one review : our war is not over till its over ⭐️⭐️⭐️⭐️⭐️ https://t.co/yppofz8rRL","1785838809575288879","https://pbs.twimg.com/ext_tw_video_thumb/1785838563185033217/pu/img/aooBIARGeAE75fFc.jpg","","en","gotham mafia","0","0","4","https://twitter.com/DesertedScope/status/1785838809575288879","1564244048122200064","DesertedScope"
"1785829389806002552","Thu May 02 00:31:20 +0000 2024","102","Probably my favorite scene from Godzilla Minus One. Never going to forget watching this film in theaters. https://t.co/9SLTSEFLSw","1785829389806002552","https://pbs.twimg.com/ext_tw_video_thumb/1785828980764884992/pu/img/y4Wh8zy9u72fVTjy.jpg","","en","Dark Aether","2","7","8","https://twitter.com/spycattorney/status/1785829389806002552","1537545882790350848","spycattorney"
"1786093355983856080","Thu May 02 18:00:14 +0000 2024","4","Godzilla Minus One (2023) Kudos to the filmmakers for delivering such an incredible movie with a budget of just $15 million! Their passion and dedication are evident in every frame. The film doesn't hold back in showcasing (1/2) https://t.co/5V10soJ7lF","1786093355983856080","https://pbs.twimg.com/media/GMl6byOXAAIvfv0.jpg","","en","Mumbai, India","0","3","1","https://twitter.com/ZeM6108/status/1786093355983856080","1322504174697816064","ZeM6108"
"1786000069658837083","Thu May 02 11:49:33 +0000 2024","2","Godzilla : Minus One | 9/10 Awesome Experience ! This is the first time I have ever felt the need to beat Godzilla . thanks to the script and the director who did a very good job on this film. https://t.co/F3HpmCKzPQ","1786000069658837083","https://pbs.twimg.com/tweet_video_thumb/GMklmCxXAAAfC1h.jpg","","en","","0","0","2","https://twitter.com/RezTalkReviews/status/1786000069658837083","1768580436484038656","RezTalkReviews"
"1785901046390280506","Thu May 02 05:16:04 +0000 2024","23","For my favorite track on Godzilla Minus One soundtrack would have to be Godzilla -1.0 Elegy. After watching the movie for the first time this track stuck with me for days. Its so haunting and i love the feeling i get whenever i play it. I also love violins so its too perfect. https://t.co/Ttf9BHRMhJ","1785901046390280506","https://pbs.twimg.com/ext_tw_video_thumb/1785900894925541377/pu/img/KneN0-Vt3Yhim79m.jpg","","en","Hollow Earth","1","1","1","https://twitter.com/Mr_goji54/status/1785901046390280506","1762480756008341504","Mr_goji54"
"1785961122803388879","Thu May 02 09:14:47 +0000 2024","3","the central message of godzilla minus one https://t.co/gGJ0R1xucs","1785961122803388879","https://pbs.twimg.com/media/GMkCDptbYAA8P2j.jpg","","en","Malaysia","0","0","2","https://twitter.com/rave21392/status/1785961122803388879","821566790891278337","rave21392"
"1786008327878799633","Thu May 02 12:22:22 +0000 2024","79"," Godzilla minus one (2023) Perfect blend of drama and action it would have been even more impactful on a big screen HD out now #Godzillaminusone #WTWJapanese #WTWAction #WTWDrama https://t.co/mPHzJ8tqdq","1786008327878799633","https://pbs.twimg.com/media/GMktG6oakAAFu_C.jpg","","en","","0","1","5","https://twitter.com/WhattoWatch15/status/1786008327878799633","1272785738120040448","WhattoWatch15"
"1786084595902894459","Thu May 02 17:25:26 +0000 2024","7","MINUS ONE IS OUT ON DIGITAL. I recommend this movie even if you're not a Godzilla/Kaiju fan. https://t.co/RV6zcIzgyD","1786084595902894459","https://pbs.twimg.com/media/GMlyeTTXoAA9Vtq.jpg","","en","भारत 🇮🇳","0","3","0","https://twitter.com/Geekdome_in/status/1786084595902894459","1524764936026476545","Geekdome_in"
"1786259713031569858","Fri May 03 05:01:17 +0000 2024","5","Working on a Morigesh video but I got stressed out since I havent done one for so long. --&gt; Proceed to buy Godzilla Minus One on bluray for Friday movie night* :))) https://t.co/DAlWNxZvpv","1786259713031569858","https://pbs.twimg.com/tweet_video_thumb/GMoRvN1XMAAUVZ6.jpg","","en","Helsinki","0","0","0","https://twitter.com/de0cant3n/status/1786259713031569858","1615092036855635971","de0cant3n"
"1786055787103801818","Thu May 02 15:30:57 +0000 2024","11","Godzilla minus one freaking masterpiece that even Hollywood can't create this kind of film. What an epic watch https://t.co/bvJZv4vnPw","1786055787103801818","https://pbs.twimg.com/ext_tw_video_thumb/1786055735836880896/pu/img/UBMdKQalQ90NwIV-.jpg","","en","Karnataka, Bijapur","0","1","1","https://twitter.com/ntr_appu/status/1786055787103801818","1027421921082658816","ntr_appu"
"1785512180080914492","Wed May 01 03:30:51 +0000 2024","17","Finally Godzilla minus one in HD!!!!! #Godzilla #GodzillaMinusOne #MinusOne https://t.co/OaPFZMQgIP","1785512180080914492","https://pbs.twimg.com/ext_tw_video_thumb/1785512138527956993/pu/img/F69ojQOVI43epOkT.jpg","","en","","1","5","1","https://twitter.com/Tyrone1760544/status/1785512180080914492","1681005733268299776","Tyrone1760544"
"1786125582272811408","Thu May 02 20:08:18 +0000 2024","9","Just watched the Godzilla minus one it was peakk but it's late now gotta sleep Good night https://t.co/GcLzBJDicx","1786125582272811408","https://pbs.twimg.com/media/GMmXwGTaQAA8L5g.jpg","","en","","0","3","0","https://twitter.com/AnakinMaybe/status/1786125582272811408","1088430542285090816","AnakinMaybe"
"1786184983725391944","Fri May 03 00:04:20 +0000 2024","1","You know what im gonna tame godzilla minus one so that i can see him everywhere https://t.co/3vsd3gGFTM","1786184983725391944","https://pbs.twimg.com/tweet_video_thumb/GMnNw1oW4AExfkL.jpg","","en","Illinois, USA","1","0","0","https://twitter.com/realParaRaptor/status/1786184983725391944","1323390012923154432","realParaRaptor"
"1785250857996476427","Tue Apr 30 10:12:27 +0000 2024","11","Minus one comes out in Japan today #Godzilla #GodzillaMinusOne #MinusOne https://t.co/v3wNIDG508","1785250857996476427","https://pbs.twimg.com/tweet_video_thumb/GMZ8MRoXQAA4raX.jpg","","en","","0","0","1","https://twitter.com/BlurrFan/status/1785250857996476427","1337249983993700352","BlurrFan"
"1785744944608710812","Wed May 01 18:55:46 +0000 2024","1975","Now for soemthing actually serious: When are they gonna drop Godzilla Minus One on the format it was meant to be seen in? https://t.co/gCU7hdiWs8","1785744944608710812","https://pbs.twimg.com/media/GMg9j-JbMAI5Vkj.jpg","","en","Mentmore Towers","6","9","216","https://twitter.com/KSPraidsagain/status/1785744944608710812","1364406071901609986","KSPraidsagain"
"1786110464734196149","Thu May 02 19:08:13 +0000 2024","58","Godzilla Minus One screen prints by @PhantomCityCrtv on sale tomorrow at @BottleneckNYC: https://t.co/z1P4L2BhCa 4 variants! https://t.co/9MYl0LmwIN","1786110464734196149","https://pbs.twimg.com/media/GMmJ-k6XoAAFHMZ.jpg","","en","Boston, MA","0","0","9","https://twitter.com/brokehorrorfan/status/1786110464734196149","20096001","brokehorrorfan"
"1786248728539521400","Fri May 03 04:17:38 +0000 2024","1","Watched Godzilla Minus One. Fantastic movie. But I really should ve watched it in theaters man. I had so many chances https://t.co/yIrcyCuKoU","1786248728539521400","https://pbs.twimg.com/tweet_video_thumb/GMoHv81WIAArraj.jpg","","en","","0","1","0","https://twitter.com/TheEtherSoul/status/1786248728539521400","2908653497","TheEtherSoul"
"1785521607932571869","Wed May 01 04:08:19 +0000 2024","220","Godzilla Minus One HD is out https://t.co/Q8ET0scg52","1785521607932571869","https://pbs.twimg.com/media/GMdyaNKXwAATKox.jpg","","en","Albuquerque, NM","23","0","28","https://twitter.com/S_All_Good_Man/status/1785521607932571869","490359324","S_All_Good_Man"
"1785983997157490754","Thu May 02 10:45:41 +0000 2024","24","#nw godzilla minus one EVERYONE CHEER https://t.co/zRJjmnYynO","1785983997157490754","https://pbs.twimg.com/ext_tw_video_thumb/1785718737623998464/pu/img/A3BzvnHdJgsUjere.jpg","","en","26 they","0","4","1","https://twitter.com/boysheron/status/1785983997157490754","1482846300953780225","boysheron"
"1786032497446281276","Thu May 02 13:58:24 +0000 2024","2","anyone wants Godzilla Minus One? https://t.co/SEFtyRX5or","1786032497446281276","https://pbs.twimg.com/media/GMlC6XIXgAAFh8x.jpg","","en","","0","1","0","https://twitter.com/kalingaddynasty/status/1786032497446281276","1577269972833030144","kalingaddynasty"
"1786330786821775393","Fri May 03 09:43:42 +0000 2024","0","Godzilla Minus One (2023) https://t.co/xblR3wHMWS","1786330786821775393","https://pbs.twimg.com/media/GMpSF7_bQAA7DD5.jpg","","en","Earth","0","0","0","https://twitter.com/3791x11/status/1786330786821775393","2383441880","3791x11"
"1786313572915814404","Fri May 03 08:35:18 +0000 2024","0","Godzilla Minus One 2023 https://t.co/KdmGKjRD0h","1786313572915814404","https://pbs.twimg.com/media/GMpCtGUbcAA2mlF.jpg","","en","tijuana","0","1","0","https://twitter.com/Pavel_MODE/status/1786313572915814404","899140631011799040","Pavel_MODE"
"1786263265225650541","Fri May 03 05:15:24 +0000 2024","0","Godzilla minus one atomic breath https://t.co/FM5E61dGWG","1786263265225650541","https://pbs.twimg.com/ext_tw_video_thumb/1786262840409731072/pu/img/31Nf3p9STPznDbH8.jpg","","en","","0","0","0","https://twitter.com/IamTheGuy69/status/1786263265225650541","1691791109553524736","IamTheGuy69"
"1785805526959362340","Wed May 01 22:56:30 +0000 2024","1","Godzilla minus one: https://t.co/KqqzbMBJpB","1785805526959362340","https://pbs.twimg.com/tweet_video_thumb/GMh0pf0WgAAfEBY.jpg","","en","Porto Alegre","0","0","1","https://twitter.com/gbeiro/status/1785805526959362340","41186683","gbeiro"
"1786036105663463856","Fri May 03 01:43:19 +0000 2024","79","Anyways watch Godzilla Minus One or Godzilla X Kong: The New Empire this month https://t.co/3PgLLJVTcm","1786209892371460350","https://pbs.twimg.com/tweet_video_thumb/GMnkbRiWsAAlXcN.jpg","Spider_Kaiju","en","New York","3","3","2","https://twitter.com/Spider_Kaiju/status/1786209892371460350","949931492200894464","Spider_Kaiju"
