"conversation_id_str","created_at","favorite_count","full_text","id_str","image_url","in_reply_to_screen_name","lang","location","quote_count","reply_count","retweet_count","tweet_url","user_id_str","username"
"1786304702839480623","Fri May 03 08:00:03 +0000 2024","1","Me: Oh my God that's disgusting! Godzilla Minus One pirated online? Where? Where did he post those? Toho : I don't know one of those disgusting torrent websites. Me: Ugh those disgusting torrent websites! I mean there's so many of them though! Which one? https://t.co/vYlT5LoS0u","1786304702839480623","https://pbs.twimg.com/tweet_video_thumb/GMo6pZVaYAAFu2Q.jpg","","en","Ampang ","0","0","0","https://twitter.com/nazeemfifteen/status/1786304702839480623","806942528859607040","nazeemfifteen"
"1784601671819317493","Sun Apr 28 15:12:49 +0000 2024","4","godzilla minus one is still not on digital https://t.co/BI1gxJx82J","1784601671819317493","https://pbs.twimg.com/tweet_video_thumb/GMQtwefa8AAdZOU.jpg","","en","pentagon","0","1","0","https://twitter.com/invincibleFan_/status/1784601671819317493","1490251261383364611","invincibleFan_"
"1785380114844307661","Tue Apr 30 18:46:04 +0000 2024","4","Goddamn I just want Godzilla Minus One to release on Blu Ray!! Pleeeeeeeeeaase!!! https://t.co/8eSvRFQuu4","1785380114844307661","https://pbs.twimg.com/tweet_video_thumb/GMbxvzjX0AAxI_F.jpg","","en","Porthold, Gaia","0","0","0","https://twitter.com/Lir_Njord/status/1785380114844307661","1680318836090843137","Lir_Njord"
"1785726502379647112","Wed May 01 17:42:30 +0000 2024","5","i have acquired godzilla minus one but the subtitles are out of sync https://t.co/u127O38LlL","1785726502379647112","https://pbs.twimg.com/tweet_video_thumb/GMgsyYmXgAAhchI.jpg","","en","Deep in the Heart of Texas","0","1","0","https://twitter.com/chryco4/status/1785726502379647112","94921665","chryco4"
"1783323445255667723","Thu Apr 25 02:33:36 +0000 2024","1800"," Godzilla Minus One/Minus Color is returning to theaters in Japan tomorrow. https://t.co/bQHTNayKBY","1783323445255667723","https://pbs.twimg.com/media/GL-jOHGW8AAwryd.jpg","","en","","27","21","131","https://twitter.com/KaijuNewsOutlet/status/1783323445255667723","1020742989558239232","KaijuNewsOutlet"
"1785279841777930339","Tue Apr 30 12:07:37 +0000 2024","4","GODZILLA MINUS ONE IS FINALLY COMING TO PRIME THIS WEEK! https://t.co/985AUJ5A9B","1785279841777930339","https://pbs.twimg.com/media/GMaWi9lWEAAbxBx.jpg","","en","Movie","0","0","2","https://twitter.com/MoviePlug254/status/1785279841777930339","1768617331985399809","MoviePlug254"
"1786165817735885172","Thu May 02 22:48:10 +0000 2024","9","I CAN FINALLY WATCH IT NOW LFG!!! #NowWatching Godzilla Minus One https://t.co/3yXqc3FaBt","1786165817735885172","https://pbs.twimg.com/tweet_video_thumb/GMm8V7xWYAAjZEz.jpg","","en","PINGAS‼️","1","1","0","https://twitter.com/beans_collector/status/1786165817735885172","1670417270751854594","beans_collector"
"1786149536122974236","Thu May 02 21:43:29 +0000 2024","0","Godzilla Minus One spoilers without context. Cool movie I enjoyed it! https://t.co/j2gj8GMA0x","1786149536122974236","https://pbs.twimg.com/tweet_video_thumb/GMmtiHQXIAAI3ES.jpg","","en","Europe","0","0","0","https://twitter.com/duuro_com/status/1786149536122974236","77717339","duuro_com"
"1786320792600412214","Fri May 03 09:03:59 +0000 2024","0","Minus One 2024 So good to watch in big screen theatres. New concept of Godzilla type movie continues to rock. Stunning visual effects and concepts. My Rating: #MinusOne https://t.co/BYfdlGzHla","1786320792600412214","https://pbs.twimg.com/media/GMpI7MSW4AA7l7Y.jpg","","en","","0","0","0","https://twitter.com/moviewithbooze/status/1786320792600412214","1767732853746401280","moviewithbooze"
"1784352647799341265","Sat Apr 27 22:43:17 +0000 2024","262","Would you guys say Godzilla in Minus One is evil? Not sure id say if he was I think he was just incredibly angry. https://t.co/tBT3EQzcAb","1784352647799341265","https://pbs.twimg.com/media/GMNLRskbQAAcaY6.jpg","","en","","11","45","20","https://twitter.com/Based_SpaceGoji/status/1784352647799341265","1427716737500278785","Based_SpaceGoji"
"1785071026134540395","Mon Apr 29 22:17:52 +0000 2024","1819","GODZILLA MINUS ONE IS COMING TO PRIME VIDEO THIS WEEK!!! https://t.co/aTI7xzQXQz","1785071026134540395","https://pbs.twimg.com/ext_tw_video_thumb/1785071008560316416/pu/img/n21w7UOqhbULaym1.jpg","","en","Proxima Centauri","15","102","75","https://twitter.com/everymovieplug/status/1785071026134540395","1245736369042780160","everymovieplug"
"1785648861215654302","Wed May 01 12:33:58 +0000 2024","19","Me convincing my friend to buy me a Godzilla: Minus One Blue-Ray DvD when she goes to Japan for the summer: https://t.co/zcDLqVf6Di","1785648861215654302","https://pbs.twimg.com/tweet_video_thumb/GMfmK-1WMAMkmbI.jpg","","en","Rottnest Island","0","2","0","https://twitter.com/QuokkaSmiles87/status/1785648861215654302","1143650885484064769","QuokkaSmiles87"
"1785765276421636316","Wed May 01 20:16:34 +0000 2024","4","Folks be really craving Godzilla Minus One so much so they're willing to take a risk accepting files from an unknown trusted sources https://t.co/giL73YlEK8","1785765276421636316","https://pbs.twimg.com/tweet_video_thumb/GMhQDVAXkAA8_47.jpg","","en","Somewhere","0","0","0","https://twitter.com/ItDoesntHappen/status/1785765276421636316","1158224837522939904","ItDoesntHappen"
"1783283381998092367","Wed Apr 24 23:54:24 +0000 2024","4","Godzilla minus one em breve https://t.co/0RA4pYTNWg","1783283381998092367","https://pbs.twimg.com/tweet_video_thumb/GL9-x10WQAAAMch.jpg","","en","","0","2","0","https://twitter.com/ed_die9/status/1783283381998092367","1107341239794438145","ed_die9"
"1786088116945629541","Thu May 02 17:39:25 +0000 2024","6","Godzilla Minus One is finally out for downloads https://t.co/YXsQeGG7n9","1786088116945629541","https://pbs.twimg.com/media/GMl1qrWWUAAfoLl.jpg","","en","England, United Kingdom","2","1","3","https://twitter.com/PauliyedII/status/1786088116945629541","871734472823197696","PauliyedII"
"1785811284392288486","Wed May 01 23:19:23 +0000 2024","2","1am and Godzilla Minus One drops online...... https://t.co/mu36RhLqN6","1785811284392288486","https://pbs.twimg.com/tweet_video_thumb/GMh55OuXMAEW__c.jpg","","en","The Phantom Dojo","0","0","0","https://twitter.com/Razzbender/status/1785811284392288486","29473724","Razzbender"
"1785791933648150643","Wed May 01 22:02:30 +0000 2024","1","Whenever you can watch Godzilla Minus One do not miss the opportunity! https://t.co/Aa0QFry1SY","1785791933648150643","https://pbs.twimg.com/tweet_video_thumb/GMhoSNHa8AA11gY.jpg","","en","🇲🇽🏳️‍🌈","0","0","0","https://twitter.com/chulomundo/status/1785791933648150643","1664221471","chulomundo"
"1785775936962519523","Wed May 01 20:58:56 +0000 2024","50","UPDATE: Godzilla minus one with english subtitle is now live on most of sites such as 123movies enjoy fellow kaijo fans https://t.co/JYqM3gNz4Y","1785775936962519523","https://pbs.twimg.com/tweet_video_thumb/GMhZua7W0AAjL-s.jpg","","en","gotham mafia","1","4","2","https://twitter.com/DesertedScope/status/1785775936962519523","1564244048122200064","DesertedScope"
"1786047996775297514","Thu May 02 15:00:00 +0000 2024","10","Godzilla: Minus One - LEGENDADO DRIVE - https://t.co/2CKInphbR3 https://t.co/hyN4yWKaAW","1786047996775297514","https://pbs.twimg.com/media/GMiRTq_W0AA5rQe.png","","en","","0","1","0","https://twitter.com/Filmes3SeriesX/status/1786047996775297514","1664812569436012544","Filmes3SeriesX"
"1785429522143195148","Tue Apr 30 22:02:24 +0000 2024","0","It's godzilla minus one week https://t.co/Dh8wVrD0nY","1785429522143195148","https://pbs.twimg.com/tweet_video_thumb/GMcerv0WsAAp-1V.jpg","","en","","0","0","0","https://twitter.com/Justafilmguy24/status/1785429522143195148","1596855403824009219","Justafilmguy24"
"1785828764649423031","Thu May 02 00:28:51 +0000 2024","0","Godzilla Minus One on t*rren*s FINALLY I USED TO PRAY FOR TIMES LIKE THIS! https://t.co/H49iwvMMqJ","1785828764649423031","https://pbs.twimg.com/tweet_video_thumb/GMiJyaabsAAEOwo.jpg","","en","","0","0","0","https://twitter.com/supercalifaggy/status/1785828764649423031","1512585938056097793","supercalifaggy"
"1784791501354217587","Tue Apr 30 08:35:31 +0000 2024","9","@gamerkong_ The entire Godzilla fandom when you call minus one a she (I could literally care less) https://t.co/N4701QRkyg","1785226463609782748","https://pbs.twimg.com/ext_tw_video_thumb/1785226455611318272/pu/img/zO2ALpeMtYtPVVyS.jpg","gamerkong_","en","","0","0","0","https://twitter.com/voulkanguy/status/1785226463609782748","1717362218759491584","voulkanguy"
"1784686266295910471","Sun Apr 28 20:48:58 +0000 2024","1","I just saw Mauler claim on EFAP that Godzilla Minus One took inspiration from the 1998 movie. https://t.co/5UhrXz8uxO","1784686266295910471","https://pbs.twimg.com/tweet_video_thumb/GMR6slPXUAAQzfW.jpg","","en","🇮🇹","0","2","0","https://twitter.com/Magistrotheriu1/status/1784686266295910471","1336462685110734848","Magistrotheriu1"
"1785668037217275947","Wed May 01 13:50:10 +0000 2024","1","Me still patiently waiting to watch Godzilla minus one properly https://t.co/zQesQXKhV9","1785668037217275947","https://pbs.twimg.com/tweet_video_thumb/GMf3mv4bwAA20x3.jpg","","en","","0","2","0","https://twitter.com/patlaborvs/status/1785668037217275947","1380807760359485446","patlaborvs"
"1786029582967075012","Thu May 02 13:46:50 +0000 2024","9","I think it s really neat how Shin Godzilla and Minus One clearly put a lot of thought into recreating and visually expounding on the keloid scars and crusted rubber texture of the original suits skin. https://t.co/AtC12GALht","1786029582967075012","https://pbs.twimg.com/media/GMlAcDCXIAAIzov.jpg","","en","","0","0","1","https://twitter.com/jblacksomething/status/1786029582967075012","2821070957","jblacksomething"
"1785780637326016634","Wed May 01 21:17:36 +0000 2024","10","Godzilla Minus One is now streaming in Japan. FINALLY a chance to see it at home in 1080p. Other countries will have it soon. https://t.co/tQWat21CZs","1785780637326016634","https://pbs.twimg.com/ext_tw_video_thumb/1785724212138713088/pu/img/b8yOQx5iuJQzdLDk.jpg","","en","","0","0","1","https://twitter.com/PopCineVerse/status/1785780637326016634","141980450","PopCineVerse"
"1785805469375705127","Wed May 01 22:56:17 +0000 2024","0","'Godzilla minus one is finally strea ..........' TPB: https://t.co/9bdVRwVA3O","1785805469375705127","https://pbs.twimg.com/tweet_video_thumb/GMh0jfwWEAAZhbq.jpg","","en","Phobos Anomaly ","0","0","0","https://twitter.com/kpa421/status/1785805469375705127","747698952","kpa421"
"1785121280137568571","Tue Apr 30 01:37:33 +0000 2024","1322","Godzilla photobombing the MUTOs wedding","1785121280137568571","","","en","mothra’s daughter","3","4","69","https://twitter.com/AutistiKal/status/1785121280137568571","1683454739940356101","AutistiKal"
"1785825339274314159","Thu May 02 01:55:09 +0000 2024","0","@the_Bradster007 Godzilla Minus One https://t.co/U1uygr5DqQ","1785850485762916791","https://pbs.twimg.com/tweet_video_thumb/GMidiEKagAAtdk5.jpg","the_Bradster007","en","Milwaukie, OR","0","1","0","https://twitter.com/GemmellRomero/status/1785850485762916791","1501761144578469888","GemmellRomero"
"1785623777780617565","Wed May 01 10:54:18 +0000 2024","6","Farewell @14_kaiju You just hit 10k Followers like 3 hours ago but your account got deleted by Toho (I think) for sharing the Godzilla Minus One Full Movie to everyone :( But atleast he has an another account For those who want to know his other account it's @color_godzilla https://t.co/6Fd9GMMFs3","1785623777780617565","https://pbs.twimg.com/media/GMfPXMmawAAdZ1z.jpg","","en","Hollow Earth / Worldwide","0","1","1","https://twitter.com/RubyDaGemX/status/1785623777780617565","1763806789701943296","RubyDaGemX"
"1785897770223910989","Thu May 02 05:03:03 +0000 2024","1","Godzilla Minus One is such a great movie . My 5th time watching lol https://t.co/GNpw5SWavG","1785897770223910989","https://pbs.twimg.com/tweet_video_thumb/GMjIjQJakAAvooc.jpg","","en","California, USA","0","0","0","https://twitter.com/Anisong2020/status/1785897770223910989","1257932925179322368","Anisong2020"
"1785690874275397817","Wed May 01 15:20:55 +0000 2024","104","godzilla minus one HD link in a couple of hours stay tuned folks https://t.co/Mhty7Qud6N","1785690874275397817","https://pbs.twimg.com/ext_tw_video_thumb/1785690776594239488/pu/img/8hQIzh_DYrB46BcQ.jpg","","en","gotham mafia","2","7","13","https://twitter.com/DesertedScope/status/1785690874275397817","1564244048122200064","DesertedScope"
"1785471946890551488","Wed May 01 00:50:59 +0000 2024","1","YA HAY TORRENTS EN 4K DE GODZILLA MINUS ONE ME PERDIERON https://t.co/dmJThYXAHo","1785471946890551488","https://pbs.twimg.com/tweet_video_thumb/GMdFRBpXUAAzmPM.jpg","","en","🇨🇱 - 19 - Él ","0","0","1","https://twitter.com/peraltabff/status/1785471946890551488","1571268195381657603","peraltabff"
"1786084745916317834","Thu May 02 17:26:01 +0000 2024","1","Godzilla Minus One (2023) https://t.co/FIQfuLqVl5","1786084745916317834","https://pbs.twimg.com/ext_tw_video_thumb/1785718737623998464/pu/img/A3BzvnHdJgsUjere.jpg","","en","","0","0","1","https://twitter.com/THESCARLETRED1/status/1786084745916317834","1549163070248914945","THESCARLETRED1"
"1785657363112050896","Wed May 01 13:07:45 +0000 2024","2","Now watching: Godzilla Minus One https://t.co/mwW3yC56fR","1785657363112050896","https://pbs.twimg.com/ext_tw_video_thumb/1785657162095894528/pu/img/STzLpk9Obj0QRcht.jpg","","en","Surakarta, Jawa Tengah","0","0","0","https://twitter.com/lintanghimself/status/1785657363112050896","410760374","lintanghimself"
"1785570806489293287","Wed May 01 07:23:49 +0000 2024","0","Godzilla minus One is finally out in ️ https://t.co/zrpzOyqjhK","1785570806489293287","https://pbs.twimg.com/tweet_video_thumb/GMefLfOWEAA_z9-.jpg","","en","Inside the matrix","0","0","0","https://twitter.com/drwtsn32exe/status/1785570806489293287","75559816","drwtsn32exe"
"1785836309531021550","Thu May 02 00:58:50 +0000 2024","3","Will Godzilla from Godzilla Minus One show up in future Godziban episodes? https://t.co/FF5xMnlBG4","1785836309531021550","https://pbs.twimg.com/tweet_video_thumb/GMiQp3cWIAA4YQP.jpg","","en","Florida, USA","0","0","2","https://twitter.com/springyjunkie/status/1785836309531021550","1687895308712165377","springyjunkie"
"1786120037247394186","Thu May 02 19:46:16 +0000 2024","7","Just watched Godzilla Minus One. Without a doubt this is the best Godzilla movie I've ever seen. The story is so emotional it shows Godzilla as a pure natural threat and the human characters are so likeable. I wish this gets a sequel. Can't wait. #GodzillaMinusOne https://t.co/aLikoemGJN","1786120037247394186","https://pbs.twimg.com/media/GMmStHoWEAAOgjW.jpg","","en","","0","4","1","https://twitter.com/DK_of_Gotham/status/1786120037247394186","1384199450751504388","DK_of_Gotham"
"1785776166676091063","Wed May 01 20:59:50 +0000 2024","0","I will be buying whatever edition I can get for Godzilla Minus One &amp; unfortunately I didn t see it in the theater but after sailing the seas I finally get to watch it at home tonight! This work day is dragging. https://t.co/q6f2CNDRlf","1785776166676091063","https://pbs.twimg.com/tweet_video_thumb/GMhZ9NQXUAAJjL_.jpg","","en","Rockwood Ontario","0","0","0","https://twitter.com/Blakewgg/status/1785776166676091063","151195336","Blakewgg"
"1785481553415667912","Wed May 01 01:29:09 +0000 2024","2","doing a lil godzilla marathon to embrace godzilla minus one for the first time this week https://t.co/HbD5ntyLpx","1785481553415667912","https://pbs.twimg.com/tweet_video_thumb/GMdOACQaUAAn3Rx.jpg","","en","26 they","0","0","0","https://twitter.com/boysheron/status/1785481553415667912","1482846300953780225","boysheron"
"1786042095574118788","Thu May 02 14:36:33 +0000 2024","4","Toho when someone tries watching Godzilla Minus One https://t.co/dWBok1ykR6","1786042095574118788","https://pbs.twimg.com/tweet_video_thumb/GMlL0P0XYAAfGcx.jpg","","en","","0","0","0","https://twitter.com/ARCTIC_ST0RM/status/1786042095574118788","730143586335891456","ARCTIC_ST0RM"
"1783253412580077610","Wed Apr 24 21:55:19 +0000 2024","0","boy kills world estreia amanha https://t.co/9gUaBtTURp","1783253412580077610","https://pbs.twimg.com/tweet_video_thumb/GL9jhcUWEAEyrhm.jpg","","en","","1","1","0","https://twitter.com/sisinluv/status/1783253412580077610","1494859103440674816","sisinluv"
"1786048309502546042","Thu May 02 15:01:14 +0000 2024","0","they finally dropped godzilla minus one on vod after a year https://t.co/ylHxJ5R9Tc","1786048309502546042","https://pbs.twimg.com/tweet_video_thumb/GMlReABXcAAIybj.jpg","","en","22 • he/him","0","0","0","https://twitter.com/fnwoodall/status/1786048309502546042","3041459643","fnwoodall"
"1785337907550810239","Tue Apr 30 15:58:21 +0000 2024","0","GODZILLA MINUS ONE IS COMING TO PRIME VIDEO THIS WEEK!!! https://t.co/E4LIOyB5v2","1785337907550810239","https://pbs.twimg.com/ext_tw_video_thumb/1785071008560316416/pu/img/n21w7UOqhbULaym1.jpg","","en","India","0","0","0","https://twitter.com/HiteshNath22372/status/1785337907550810239","1663412085857075200","HiteshNath22372"
"1786114864437469587","Fri May 03 04:37:02 +0000 2024","0","@BGatesIsaPyscho Godzilla Minus One https://t.co/BWRJ508XLK","1786253610558406959","https://pbs.twimg.com/ext_tw_video_thumb/1786253175424516096/pu/img/cpKFLYcJbaOKcvln.jpg","BGatesIsaPyscho","en","Santiago, Chile","0","0","0","https://twitter.com/SiberianBeckham/status/1786253610558406959","1442836353608212486","SiberianBeckham"
"1786285158146212002","Fri May 03 06:42:23 +0000 2024","0","Hmmm....maybe its time to watch godzilla minus one. https://t.co/wJzVhEIM3p","1786285158146212002","https://pbs.twimg.com/media/GMoo4ovawAABley.jpg","","en","","0","0","0","https://twitter.com/Flowervast/status/1786285158146212002","1530140315733983233","Flowervast"
"1786048523756277898","Thu May 02 15:02:05 +0000 2024","53","Godzilla Minus One was one of the best movies of last year and now finally it has the limited edition poster it deserves. @io9 has your exclusive first look at @PhantomCityCrtv s epic piece via @BottleneckNYC https://t.co/7k9SSqDOSA","1786048523756277898","","","en","Los Angeles, CA. NYer at Heart","0","4","10","https://twitter.com/GermainLussier/status/1786048523756277898","18216888","GermainLussier"
"1785753086373290104","Wed May 01 19:28:08 +0000 2024","1","I m Watching : Godzilla Minus One https://t.co/eFw5YWiBhL","1785753086373290104","https://pbs.twimg.com/media/GMhE9yEWAAA-Juw.jpg","","en","","1","1","0","https://twitter.com/RezTalkReviews/status/1785753086373290104","1768580436484038656","RezTalkReviews"
"1785933581732192521","Thu May 02 07:25:21 +0000 2024","19","എജ്ജാതി പണ്ണൽ Might have been an EXPERIENCE if it was released here too.....BIG MISS :( Godzilla Minus One is the textbook example for how to light up the dorsal ridges https://t.co/9AbBeDNSez","1785933581732192521","https://pbs.twimg.com/media/GMjpFYWXEAA78I0.jpg","","en","","0","3","1","https://twitter.com/Jaasim_3/status/1785933581732192521","1293451652133945344","Jaasim_3"
"1785358339662057950","Tue Apr 30 17:19:33 +0000 2024","139","GODZILLA MINUS ONE has won the Rondo Hatton Classic Horror Award for Best Film of 2023 in a landslide vote! The awards which are voted on by the horror/monster fan community received record-breaking numbers as voters overwhelmingly backed MINUS ONE for the win. https://t.co/89kh10A8PA","1785358339662057950","https://pbs.twimg.com/media/GMbbre3WwAE2tS9.jpg","","en","","1","2","30","https://twitter.com/Danzilla93_GNP/status/1785358339662057950","969444008471748609","Danzilla93_GNP"
"1786143666718789978","Thu May 02 21:20:09 +0000 2024","0","Godzilla: Minus One https://t.co/uvxhud05yp","1786143666718789978","https://pbs.twimg.com/tweet_video_thumb/GMmoMjzXIAEdbfD.jpg","","en","New Orleans ","0","0","0","https://twitter.com/VDuccets/status/1786143666718789978","341873008","VDuccets"
"1785767218791272605","Wed May 01 20:24:17 +0000 2024","1","After 7 months of avoiding spoilers i finally have a chance to watch Godzilla Minus One. And it's just... https://t.co/kGw6Me0EzT","1785767218791272605","https://pbs.twimg.com/media/GMhR0OgX0AE3Pzi.jpg","","en","","0","0","0","https://twitter.com/AethraDK/status/1785767218791272605","1202429046228844544","AethraDK"
"1786009005631971451","Thu May 02 12:25:04 +0000 2024","0","GODZILLA: MINUS ONE JUST DROPPED!!! https://t.co/FUKLpg9Flb","1786009005631971451","https://pbs.twimg.com/tweet_video_thumb/GMktuT1WcAAdpxD.jpg","","en","That's a random variable!","0","0","0","https://twitter.com/AxlPif/status/1786009005631971451","149583296","AxlPif"
"1784435449123188976","Sun Apr 28 04:12:18 +0000 2024","104","Ok so everyone wants a Minus One sequel and I m all for it. But if Toho chose not to go that route I d love for them to make a truly evil Godzilla. We haven t had once since GMK and it s such an interesting take on the character. https://t.co/AGifeCauLj","1784435449123188976","https://pbs.twimg.com/media/GMOWlVyacAA5ldg.jpg","","en","","1","14","16","https://twitter.com/Based_SpaceGoji/status/1784435449123188976","1427716737500278785","Based_SpaceGoji"
"1785939189457883256","Thu May 02 07:47:38 +0000 2024","0","The atomic breath of Godzilla from minus one #GodzillaMinusOne https://t.co/bUdbTyfMP5","1785939189457883256","https://pbs.twimg.com/tweet_video_thumb/GMjuOJVXoAE2Pnp.jpg","","en","Akright City, Entebbe","0","0","0","https://twitter.com/EddyIos/status/1785939189457883256","954319395349848064","EddyIos"
"1785961768545919086","Thu May 02 09:17:21 +0000 2024","12","Godzilla minus one with subs up on the cat site today is the day https://t.co/MaSv7KTcla","1785961768545919086","https://pbs.twimg.com/media/GMkCw38WsAAjv9g.jpg","","en","","0","3","0","https://twitter.com/ApeManSid/status/1785961768545919086","1346829358820782081","ApeManSid"
"1786117996777283632","Thu May 02 19:38:09 +0000 2024","0","My Wifi is gone on the day that Godzilla minus one drops on Blue Ray. https://t.co/umrkrUEHh2","1786117996777283632","https://pbs.twimg.com/tweet_video_thumb/GMmQyqFWQAARy9m.jpg","","en","","0","0","0","https://twitter.com/iNimm_/status/1786117996777283632","488715699","iNimm_"
"1786107747454341438","Thu May 02 18:57:25 +0000 2024","5","CALLING ALL KAIJU MOVIE FANS CALLING ALL KAIJU MOVIE FANS GODZILLA: MINUS ONE IS NOW OUT ON DIGITAL https://t.co/3EyTnIPULM","1786107747454341438","https://pbs.twimg.com/media/GMmHh8VXgAAfp1F.jpg","","en","Johannesburg, South Africa","2","5","0","https://twitter.com/Mavi084/status/1786107747454341438","3134867587","Mavi084"
"1785858889139036507","Thu May 02 02:28:33 +0000 2024","9","Godzilla: Minus One (rewatch) Still 10/10 If you didn t watch this movie in theaters I implore you to watch it on your own time. https://t.co/JlUzJwJzSv","1785858889139036507","https://pbs.twimg.com/media/GMilMUna0AAvNyY.jpg","","en","","0","1","1","https://twitter.com/Oomfie_Chip/status/1785858889139036507","3226914541","Oomfie_Chip"
"1785772438921343202","Wed May 01 20:45:02 +0000 2024","0","GODZILLA MINUS ONE Official Trailer Download Full Movie Below https://t.co/wahnZnPjN3","1785772438921343202","https://pbs.twimg.com/ext_tw_video_thumb/1785772340350943233/pu/img/RiHXWTFwlBFpN-cf.jpg","","en","Accra, Ghana","0","0","0","https://twitter.com/Kadmovieacademy/status/1785772438921343202","1750512589438668800","Kadmovieacademy"
"1741988032700420567","Thu May 02 03:48:01 +0000 2024","3","105. Godzilla Minus One (2023) might be the greatest movie ever OHHHHHH MY OGDDDDDDDDD https://t.co/568puZEBoq","1785878889065062670","https://pbs.twimg.com/media/GMi3WOAXIAABVAb.jpg","tomorinon","en","oki","0","2","0","https://twitter.com/tomorinon/status/1785878889065062670","1524263499588939785","tomorinon"
"1786215330580230158","Fri May 03 02:04:55 +0000 2024","18","Day 123 of drawing Godzilla until Minus One drops in Argentina https://t.co/i0nl9rMSdZ","1786215330580230158","https://pbs.twimg.com/media/GMnpYDSWUAIThVy.jpg","","en","Phobos","0","0","2","https://twitter.com/n05c0p3r_/status/1786215330580230158","3366593933","n05c0p3r_"
"1785202303047193000","Tue Apr 30 06:59:31 +0000 2024","1","Godzilla: minus one elegy scene (rescore) #gojira https://t.co/N7utNiJD9t","1785202303047193000","https://pbs.twimg.com/ext_tw_video_thumb/1785202239201587200/pu/img/Ah__1RF8P-L7wVy7.jpg","","en","","0","0","0","https://twitter.com/Fnaf_fan2o/status/1785202303047193000","1715903412691152896","Fnaf_fan2o"
"1785873533337510130","Thu May 02 03:26:44 +0000 2024","0","I JUST FINISHED WATCHING GODZILLA MINUS ONE AND DAMN https://t.co/td6icQCtvO","1785873533337510130","https://pbs.twimg.com/tweet_video_thumb/GMiygfyawAAKWsy.jpg","","en","Indonesia","0","0","0","https://twitter.com/ttorroo/status/1785873533337510130","96331433","ttorroo"
"1784960168075157874","Mon Apr 29 14:57:21 +0000 2024","830"," This next battle is not one waged to the death but a battle to live for the future. Part 1 of our new officially licensed GODZILLA MINUS ONE collection arrives TODAY AT 5 PM EST! ️ Read below for details! #GodzillaMinusOne https://t.co/ucGfDkmLSA","1784960168075157874","https://pbs.twimg.com/media/GMVyDYuXIAA18vf.jpg","","en","Atlanta, GA","17","17","148","https://twitter.com/CAVITYCOLORS/status/1784960168075157874","16064458","CAVITYCOLORS"
"1785692272010617111","Wed May 01 15:26:28 +0000 2024","0","A local free movie website (pirate obv) got godzilla minus one in hd I really want to watch it but as a fan I guess I still have to hold myself until the official one is released.... https://t.co/F9nZ3JmeU1","1785692272010617111","https://pbs.twimg.com/media/GMgNGk3aUAEsY1A.png","","en","","0","5","0","https://twitter.com/gerald_kwee/status/1785692272010617111","1409375055591612417","gerald_kwee"
